{
  "experiment": "02-proof-interface-graph",
  "status": "outline_only",
  "evidence_boundary": "Nodes and edges are transcribed from the OpenAI public announcement and a public proof-outline discussion; the complete 166-page proof artifact was not available to this run. No node is claimed to be a complete formal proof subsystem.",
  "source_artifacts": [
    {"path":"Resolution_of_the_Navier_Stokes_Existenc.pdf","sha256":"a44e791ab9b7912222343e31296f0968a7a0cf27446e2a918087bc5fd14ee38c","pages":2,"classification":"unrelated_local_candidate_rejected"},
    {"url":"https://openai.com/index/navier-stokes-solution/","classification":"public_announcement"},
    {"url":"https://mathoverflow.net/questions/515056/proof-outline-and-discussion-openais-claimed-forced-blowup-construction-for-na","classification":"public_proof_outline_discussion"}
  ],
  "nodes": [
    {"id":"self-similar-profile","name":"Self-similar concentrating background","assumptions":["similarity coordinates and concentration parameter are defined","constructed background has the claimed singular growth"],"internal_construction":"A concentrating, axisymmetric background flow is described in similarity variables.","exported_object":"background velocity/pressure fields and their induced momentum residual","validation_condition":"check the fields and scaling satisfy the stated local regularity, support, and growth conditions","source_refs":["openai-announcement:result","mathoverflow-outline:stage-1"],"derivation_status":"public-outline_only"},
    {"id":"residual-stress","name":"Residual represented as stress","assumptions":["background fields are defined","Navier–Stokes residual can be expressed as a stress divergence"],"internal_construction":"Rewrite the background momentum residual as the divergence of a stress supported in an annulus.","exported_object":"stress tensor T and its support/moment constraints","validation_condition":"verify the divergence identity, support, and matching constraints","source_refs":["openai-announcement:result","mathoverflow-outline:stage-2"],"derivation_status":"public-outline_only"},
    {"id":"wave-families","name":"Oscillatory pulse families","assumptions":["stress lies in an admissible realization region","localized divergence-free pulses can be constructed"],"internal_construction":"Construct localized oscillatory pulse families with prescribed scales, amplitudes, and disjoint auxiliary supports.","exported_object":"pulse fields and quadratic momentum-flux covariances","validation_condition":"verify divergence-free structure, localization, scale bounds, and absence of forbidden cross-terms","source_refs":["mathoverflow-outline:stage-2"],"derivation_status":"public-outline_only"},
    {"id":"stress-realization","name":"Stress realization and leading cancellation","assumptions":["pulse covariance vectors span the required stress cone","amplitude coefficients satisfy the declared positivity conditions"],"internal_construction":"Choose pulse amplitudes so averaged quadratic flux realizes the target stress and cancels its leading divergence.","exported_object":"realized stress cancellation plus new residual terms","validation_condition":"verify the averaged flux identity and quantify the residual after cancellation","source_refs":["mathoverflow-outline:stage-2","openai-announcement:result"],"derivation_status":"public-outline_only"},
    {"id":"correction-cycle","name":"Iterative correction cycle","assumptions":["new residual admits the stated correction operators","decay exponent improves on each pass"],"internal_construction":"Repeat wave-amplitude, stress, mean, and moment corrections while tracking shrinking cutoffs and residual decay.","exported_object":"corrected fields and residual flatness estimates","validation_condition":"verify each correction identity and convergence/flatness claim under the declared norms","source_refs":["mathoverflow-outline:stage-3"],"derivation_status":"public-outline_only"},
    {"id":"localization-conclusion","name":"Localization and theorem conclusion","assumptions":["flat residual extends smoothly through the singular time","energy and uniqueness estimates hold"],"internal_construction":"Apply compact cutoffs, define the force from the final residual, establish energy control, and transport the construction to the torus.","exported_object":"localized solution, smooth force, energy bound, and theorem-level conclusion","validation_condition":"verify smooth extension, support, energy, uniqueness, and rescaling/periodization conditions","source_refs":["mathoverflow-outline:stage-4","openai-announcement:result"],"derivation_status":"public-outline_only"}
  ],
  "edges": [
    {"from":"self-similar-profile","to":"residual-stress","literal_interface":"background velocity/pressure fields together with the momentum residual they induce","source_refs":["mathoverflow-outline:stage-1"]},
    {"from":"residual-stress","to":"wave-families","literal_interface":"target stress tensor, annular support, and moment constraints","source_refs":["mathoverflow-outline:stage-2"]},
    {"from":"wave-families","to":"stress-realization","literal_interface":"pulse fields and their averaged quadratic flux covariance vectors","source_refs":["mathoverflow-outline:stage-2"]},
    {"from":"stress-realization","to":"correction-cycle","literal_interface":"partially canceled fields and the residual terms introduced by realization","source_refs":["mathoverflow-outline:stage-3"]},
    {"from":"correction-cycle","to":"localization-conclusion","literal_interface":"corrected fields, residual flatness estimates, and preserved moment/energy conditions","source_refs":["mathoverflow-outline:stage-3","mathoverflow-outline:stage-4"]}
  ],
  "not_yet_measured": ["minimal sufficient interface", "interface width", "state byte size", "proof completeness", "independent mathematical validity"]
}
